<?xml version="1.0" encoding="utf-8"?>
<!--
 * =========================================================================== *
 * This file is part of CARDAMOM (R) which is jointly developed by THALES
 * and SELEX-SI.
 * 
 * It is derivative work based on PERCO Copyright (C) THALES 2000-2003.
 * All rights reserved.
 * 
 * CARDAMOM is free software; you can redistribute it and/or modify it under
 * the terms of the GNU Library General Public License as published by the
 * Free Software Foundation; either version 2 of the License, or (at your
 * option) any later version.
 * 
 * CARDAMOM is distributed in the hope that it will be useful, but WITHOUT
 * ANY WARRANTY; without even the implied warranty of MERCHANTABILITY or
 * FITNESS FOR A PARTICULAR PURPOSE. See the GNU Library General Public
 * License for more details.
 * 
 * You should have received a copy of the GNU Library General
 * Public License along with CARDAMOM; see the file COPYING. If not, write to
 * the Free Software Foundation, Inc., 675 Mass Ave, Cambridge, MA 02139, USA.
 * =========================================================================== *
-->

<!DOCTYPE CdmwPlatformMngtDaemon SYSTEM "CdmwPlatformMngtDaemon.dtd">

<CdmwPlatformMngtDaemon>
	<SystemPort>21869</SystemPort>
	<UID>-1</UID>
	<GID>-1</GID>
	<LogFile>CdmwDaemon.log</LogFile>
	<IorFile>CdmwDaemon.ior</IorFile>
	<NotificationCallTimeout>10000</NotificationCallTimeout>
    <RequestDurationTime>20000000</RequestDurationTime>
    <SimplePullCorbaloc>corbaloc:miop:1.0@1.0-cdmw_ftdomain-1/225.1.1.8:4556</SimplePullCorbaloc>
    <SimplePushCorbaloc>corbaloc:miop:1.0@1.0-cdmw_ftdomain-2/225.1.1.8:4557</SimplePushCorbaloc>
</CdmwPlatformMngtDaemon>

